[
  {
    "id": "bd912b81",
    "title": "ROMANTIK AM VERTRÄUMTEN FORSTSEELI",
    "description": "Forstseeli – Alp Heieren – Eggli – Vom öffentlichen Parkplatz beim Schützenstand oder von der Kirche Eggerstanden aus starten Sie in östliche Richtung. Bleiben Sie auf der schmalen Flurstrasse, bis Sie rechts über offenes Gelände hangaufwärts in Rich- tung Unterer Bildstein und Bildsteinkopf abzweigen können. Durch Wald und über Weiden sowie an herzigen «Gädeli» vorbei, gelangen Sie zum verträumten Forstseeli. Geniessen Sie diesen schönen Ort mitten im Wald.",
    "region": "Appenzell",
    "duration": "3 Stunden",
    "distance": "8.73 km",
    "elevation_gain": "510m",
    "elevation_loss": "510m",
    "restaurants": [
      "Restaurant Eggli",
      "Gasthof Neues Bild",
      "Wirtschaft Altes Bild"
    ],
    "sac_scale": "T2",
    "highlights": [
      "See",
      "Alpstein",
      "Alp"
    ],
    "source_pdf": "Appenzell_Wanderungen.pdf",
    "page_number": 8,
    "raw_text": "--- Seite 8 ---\nTAL- UND HÜGELWEGE\n88\nROMANTIK AM VERTRÄUMTEN FORSTSEELI\nEggerstanden – Bildstein –\nForstseeli – Alp Heieren – Eggli –\nEggerstanden\n3 Stunden\nWirtschaft Altes Bild,\nLandgasthof Neues Bild,\nRestaurant Eggli\n8.73 km 510 m 510 m\nSAC-Wanderskala\nT 2\nVom öffentlichen Parkplatz beim Schützenstand oder von der Kirche Eggerstanden aus starten Sie in östliche\nRichtung. Bleiben Sie auf der schmalen Flurstrasse, bis Sie rechts über offenes Gelände hangaufwärts in Rich-\ntung Unterer Bildstein und Bildsteinkopf abzweigen können. Durch Wald und über Weiden sowie an herzigen\n«Gädeli» vorbei, gelangen Sie zum verträumten Forstseeli. Geniessen Sie diesen schönen Ort mitten im Wald.\nEine Feuerstelle mit Bänkli und Brennholz steht zur Verfügung und lädt zum Bräteln ein. Weiter geht es im\nWald hinauf auf die Alpweiden am nördlichen Abhang der Fähneren. Leicht absteigend erreichen Sie über die\nAlp Heieren das Restaurant Eggli. Geniessen Sie auf der Terrasse die einzigartige Sicht auf die drei Bergketten\ndes Alpsteins. Kinder freuen sich an den vielen verschiedenen Tieren, die hier zu Hause sind und toben sich auf\ndem Spielplatz aus. Vom Eggli geht es kurz auf gleichem Weg rund 200 Meter zurück zum Abzweiger hinunter\nnach Eggerstanden. Am Nordhang führt der Abstiegsweg wieder zum Ausgangspunkt zurück, den Sie übrigens\nsehr praktisch mit dem PubliCar (Rufbus) erreichen können. Reservation via App oder Tel. 0848 55 30 60.\nTipp: Machen Sie eine kleine Zusatzschlaufe (geradeaus anstatt hangaufwärts abzweigen) zur malerisch gele-\ngenen Kapelle Maria Bildstein, mitten im Wald."
  },
  {
    "id": "e1b4249c",
    "title": "CHLUSTOBELWEG",
    "description": "Diese idyllische, familienfreundliche Route eignet sich für Jung und Alt gleichermassen. Auf einem einfachen Wanderweg über Wiesen und auf Waldpfaden wandern Sie in ungefähr einer Stunde (mit bräteln und schlen- dern beliebig verlängerbar) von Weissbad nach Brülisau. Gerade auch an heissen Sommertagen locken die schattigen Waldpassagen und auch im farbigen Herbst ist die Wanderung besonders schön.",
    "region": "Appenzell",
    "duration": "1 Stunde",
    "distance": "3.14 km",
    "elevation_gain": "184m",
    "elevation_loss": "78m",
    "restaurants": [
      "Gasthaus Rössli"
    ],
    "sac_scale": "T1",
    "highlights": [],
    "source_pdf": "Appenzell_Wanderungen.pdf",
    "page_number": 9,
    "raw_text": "--- Seite 9 ---\nCHLUSTOBELWEG\nWeissbad – Brülisau\n1 Stunde\nHotel Hof Weissbad,\nGarni Loosmühle,\nHotel Belvedere, Gasthaus Rössli\n3.14 km 184 m 78 m\nSAC-Wanderskala\nT 1\nDiese idyllische, familienfreundliche Route eignet sich für Jung und Alt gleichermassen. Auf einem einfachen\nWanderweg über Wiesen und auf Waldpfaden wandern Sie in ungefähr einer Stunde (mit bräteln und schlen-\ndern beliebig verlängerbar) von Weissbad nach Brülisau. Gerade auch an heissen Sommertagen locken die\nschattigen Waldpassagen und auch im farbigen Herbst ist die Wanderung besonders schön. Kurz nach dem\nBahnhof Weissbad überquert man bereits den Brüelbach, dem die Wanderung anschliessend stets folgt. Nach\neinem sehr kurzen Abschnitt auf dem Trottoir wandern Sie die ganze Zeit auf natürlichem Untergrund. Vorbei\nan den letzten Häusern im Quartier «Scheregg» geht es abwechselnd im Wald oder dem Waldrand entlang.\nLeicht ansteigend und mit immer wieder schönen Ausblicken Richtung Hoher Kasten und Sigel, erreichen Sie\nmit dem stetigen Rauschen des Baches im Ohr, Brülisau. Zurück geht es mit dem Postauto oder auf demselben\nWeg.\nTipp: Eine sehr schöne Grillstelle lädt nach ungefähr einem Drittel der Wanderstrecke zum Bräteln ein."
  },
  {
    "id": "a4a05472",
    "title": "POTERSALP RUNDWANDERUNG",
    "description": "Das Waldgasthaus Lehmen unterhalb zurücklassend, gelangen Sie nach einer kurzen Waldpassage zu den drei aufeinander folgenden Alprechten Vordere Leu – Leustöckli – Gross Leu. Direkt vor Ihnen erhebt sich die nördli- che Säntiskette. Von Ost nach West der Schäflergipfel, die Altenalptürme und das markante Öhrli. Über den Berndlibach, das Gross Berndli und das Schwizerälpli führt der Aufstieg zum höchsten Punkt dieser Rundtour, der Verzweigung «Schwizerälpli» beim Oberen Borstböhl.",
    "region": "Appenzell",
    "duration": "3 Stunden 30 Minuten",
    "distance": "11.44 km",
    "elevation_gain": "496m",
    "elevation_loss": "496m",
    "restaurants": [
      "Gasthaus Lehmen",
      "Gasthaus Lehmen unterhalb zurücklassend",
      "Alp RUNDWANDERUNG"
    ],
    "sac_scale": "T2",
    "highlights": [
      "Gipfel",
      "Säntis",
      "Alp"
    ],
    "source_pdf": "Appenzell_Wanderungen.pdf",
    "page_number": 10,
    "raw_text": "--- Seite 10 ---\nTAL- UND HÜGELWEGE\n10\nPOTERSALP RUNDWANDERUNG\nLehmen – Vordere Leu –\nGrossberndli – Schwizerälpli –\nPotersalp – Böhlhütte –\nLeuenfall – Lehmen\n3 Stunden 30 Minuten\nWaldgasthaus Lehmen\n11.44 km 496 m 496 m\nSAC-Wanderskala\nT 2\nDas Waldgasthaus Lehmen unterhalb zurücklassend, gelangen Sie nach einer kurzen Waldpassage zu den drei\naufeinander folgenden Alprechten Vordere Leu – Leustöckli – Gross Leu. Direkt vor Ihnen erhebt sich die nördli-\nche Säntiskette. Von Ost nach West der Schäflergipfel, die Altenalptürme und das markante Öhrli. Über den\nBerndlibach, das Gross Berndli und das Schwizerälpli führt der Aufstieg zum höchsten Punkt dieser Rundtour,\nder Verzweigung «Schwizerälpli» beim Oberen Borstböhl. Folgen Sie der Signalisation Richtung Chammhalden-\nhütte-Schwägalp und nach wenigen Metern gelangen Sie zu den Gemeinschaftsalpen der Potersalp, wo die Route\nnach Lehmen abzweigt. Jeden Sommer findet beim Alprecht Dreihütten die «Potesalpe-Stobede» statt. Auf einem\nSchottersträsschen folgt nun eine ausgiebige Waldwanderung bis zum Leuenfall, wo sich das Wasser des Berndli-\nbaches tosend in die Tiefe stürzt. Nur wenige Schritte und Sie sind wieder beim Ausgangspunkt Waldgasthaus\nLehmen, den Sie übrigens sehr praktisch mit dem PubliCar (Rufbus) erreichen. Reservation via App oder\nTel. 0848 55 30 60.\nHinweis: Bitte beachten Sie, dass die Tour im Gelände nicht explizit als Rundweg beschildert ist. Orientieren Sie\nsich mit Hilfe der Zwischenziele auf den Wegweisern. Der Weg kann in beide Richtungen begangen werden."
  },
  {
    "id": "6119685d",
    "title": "IM 7. WANDERHIMMEL AUF ZUM HIMMELBERG",
    "description": "Krone, Bären, Löwen, Café Rössli, Eine genussvolle Hügeltour mit anfänglicher Steigung, gefolgt von einer gemütlichen Gratwanderung nach Appenzell mit schönster Alpsteinsicht. Vom Bahnhof Gonten geht über die Hauptstrasse und den Wiesenweg zwischen Huus Bären und der ehem. Metzgerei Wetter hinauf über den Hügelrücken zur Göbsi. Bald wandern Sie im Zickzack steil hinauf zur Hund-",
    "region": "Appenzell",
    "duration": "3 Stunden 15 Minuten",
    "distance": "10.13 km",
    "elevation_gain": "494m",
    "elevation_loss": "609m",
    "restaurants": [
      "Restaurant Hundwiler Höhe",
      "Restaurant s in Appenzell",
      "Café Rössli"
    ],
    "sac_scale": "T2",
    "highlights": [
      "Alpstein",
      "Alp",
      "Gratwanderung"
    ],
    "source_pdf": "Appenzell_Wanderungen.pdf",
    "page_number": 11,
    "raw_text": "--- Seite 11 ---\n11\nIM 7. WANDERHIMMEL AUF ZUM HIMMELBERG\nGonten – Göbsi –\nHundwiler Höhe – Ochsenhöhi\nChuterenegg – Himmelberg –\nFlucht – Münz – Appenzell\n3 Stunden 15 Minuten\nKrone, Bären, Löwen, Café Rössli,\nBergrestaurant Hundwiler Höhe,\ndiverse Restaurants in Appenzell\n10.13 km 494 m 609 m\nSAC-Wanderskala\nT 2\nEine genussvolle Hügeltour mit anfänglicher Steigung, gefolgt von einer gemütlichen Gratwanderung nach\nAppenzell mit schönster Alpsteinsicht.\nVom Bahnhof Gonten geht über die Hauptstrasse und den Wiesenweg zwischen Huus Bären und der ehem.\nMetzgerei Wetter hinauf über den Hügelrücken zur Göbsi. Bald wandern Sie im Zickzack steil hinauf zur Hund-\nwiler Höhe, wo Sie mit einer fantastischen Rundsicht über das Appenzellerland belohnt werden. In südlicher\nRichtung sehen Sie den Kronberg und dahinter hoch aufragend die nördliche Alpsteinkette. Nehmen Sie den\nWanderweg in östliche Richtung unter die Füsse. Zuerst überschreiten Sie den höchsten Punkt, dann steigen Sie\nab über Ochsenhöhi-Chuterenegg. Auf dem Grat geht es gemütlich weiter zur Liegenschaft Himmelberg. In östli-\ncher Richtung durchqueren Sie den Schattenwald und später geht es dem sonnigen Waldrand entlang hinunter\nzum Fluchtrank. Nach vorsichtiger Querung der Hauptstrasse wandern Sie auf dem letzten, idyllischen\nAbschnitt über den Kaubach und durch einen speziellen Felsdurchbruch auf einem Hohlweg zurück ins farben-\nfrohe Dorf Appenzell.\nTipp: Kurz nach dem Bergrestaurant Hundwiler Höhe lädt eine schön gelegene Feuerstelle zum Bräteln."
  },
  {
    "id": "0a454635",
    "title": "AUSSICHTSREICHER HÜGELGENUSS AUF DEM HOHEN HIRSCHBERG",
    "description": "Kapelle St. Ottilia – Sammelplatz Ausgehend vom Sammelplatz, wandern Sie auf einem gepflegten Weg über die grosszügigen Wiesen der Mendle-Genossenschaft. Unterwegs durchqueren Sie eine wunderschöne Riedlandschaft – ein artenreiches Flachmoor mit Magerwiesen. Das darauffolgende Wegstück führt auf dem Forststrässchen durch den Wald und schon stehen Sie fast beim Berggasthaus Hoher Hirschberg.",
    "region": "Appenzell",
    "duration": "2 Stunden 30 Minuten",
    "distance": "8.76 km",
    "elevation_gain": "301m",
    "elevation_loss": "301m",
    "restaurants": [
      "Gasthaus Hoher Hirschberg",
      "Hütte n",
      "Berggasthaus Hoher Hirschberg"
    ],
    "sac_scale": "T2",
    "highlights": [
      "Aussicht"
    ],
    "source_pdf": "Appenzell_Wanderungen.pdf",
    "page_number": 12,
    "raw_text": "--- Seite 12 ---\nTAL- UND HÜGELWEGE\n12\nAUSSICHTSREICHER HÜGELGENUSS AUF DEM HOHEN HIRSCHBERG\nSammelplatz – Mendle –\nHütten – Hoher Hirschberg –\nHütten – Guggerloch –\nKapelle St. Ottilia – Sammelplatz\n2 Stunden 30 Minuten\nBerggasthaus Hoher Hirschberg\n8.76 km 301 m 301 m\nSAC-Wanderskala\nT 2\nAusgehend vom Sammelplatz, wandern Sie auf einem gepflegten Weg über die grosszügigen Wiesen der\nMendle-Genossenschaft. Unterwegs durchqueren Sie eine wunderschöne Riedlandschaft – ein artenreiches\nFlachmoor mit Magerwiesen. Das darauffolgende Wegstück führt auf dem Forststrässchen durch den Wald und\nschon stehen Sie fast beim Berggasthaus Hoher Hirschberg.\nGeniessen Sie dort bei einer Einkehr die fantastische und weitum bekannte Rundsicht. Zurück wandern Sie auf\ndemselben Pfad entlang dem Strässchen bis Hütten. Anstatt Richtung Sammelplatz zu halten, folgt nun eines\nder schönsten Wegstücke überhaupt: Der breite, liebliche und phänomenal aussichtsreiche Hirschberg-Rücken.\nDieser endet bei der Abzweigung Guggerloch, wo Sie die Route nach rechts in den Wald und zur besonderen\nKapelle St. Ottilia führt. Von dort ist es nicht mehr weit, bis Sie zum Waldrand und zum Sammelplatz gelangen.\nTipp: Die Heilige Ottilia ist die Patronin des Augenlichts. Benetzen Sie für mehr Durchblick oder bei Augenlei-\nden Ihre Augen mit dem Wasser aus dem Brunnen neben der Kapelle – es hilft."
  },
  {
    "id": "6e2afcaf",
    "title": "SONNENWANDERUNG FÜR JEDE JAHRESZEIT",
    "description": "Leimensteig – Arenholz – Haslen Ein Panoramaweg sondergleichen für Jung und Alt. Von der Bahnstation Sammelplatz wandern Sie in westlic- her Richtung zuerst auf einem Strässchen, dann einen Wiesenpfad den Hügel hinauf bis zur Liegenschaft Rel- len. Als nächstes lockt die schmucke Kapelle Maria Hilf im Acker für eine Rast und Sie wandern flach weiter bis zum Saul. Nun folgt ein Panoramaweg, bei welchem zur Rechten der Gäbris und die Hohe Buche sowie die",
    "region": "Appenzell",
    "duration": "2 Stunden",
    "distance": "7.50 km",
    "elevation_gain": "209m",
    "elevation_loss": "397m",
    "restaurants": [
      "Restaurant Linde",
      "Restaurant Krone",
      "Gasthaus Leimensteig"
    ],
    "sac_scale": "T2",
    "highlights": [
      "Panorama",
      "Alpstein",
      "Alp"
    ],
    "source_pdf": "Appenzell_Wanderungen.pdf",
    "page_number": 13,
    "raw_text": "--- Seite 13 ---\n13\nSONNENWANDERUNG FÜR JEDE JAHRESZEIT\nSammelplatz – Rellen –\nSaul – Steigershus –\nLeimensteig – Arenholz – Haslen\n2 Stunden\nGasthaus Leimensteig,\nRestaurant Linde,\nRestaurant Krone\n7.50 km 209 m 397 m\nSAC-Wanderskala\nT 2\nEin Panoramaweg sondergleichen für Jung und Alt. Von der Bahnstation Sammelplatz wandern Sie in westlic-\nher Richtung zuerst auf einem Strässchen, dann einen Wiesenpfad den Hügel hinauf bis zur Liegenschaft Rel-\nlen. Als nächstes lockt die schmucke Kapelle Maria Hilf im Acker für eine Rast und Sie wandern flach weiter\nbis zum Saul. Nun folgt ein Panoramaweg, bei welchem zur Rechten der Gäbris und die Hohe Buche sowie die\nDörfer Gais, Bühler und Teufen grüssen und links sich die Nordwände des Alpsteins, der Kronberg und die\nHundwiler Höhe türmen. Dann gelangen Sie auf ein Fahrsträsschen. Auffallend schön ist im Gebiet Gehren-\nberg-Saul die typische Streusiedlung mit den Appenzeller Bauernhäusern. Bald lädt die Sonnenterrasse des\nGasthauses Leimensteig zum Verweilen ein und bietet Ihnen eine wunderschöne Sicht auf den Alpstein. Von\nhier führt der Wanderweg entlang der Nebenstrasse hinunter Richtung Haslen. Bald zweigt die Route auf dem\nHügelrücken abwärts ab und nach einem kurzen Waldstück mit Feuerstelle sind Sie wieder in Haslen. Dort\nkönnen Sie entweder das Postauto nach Teufen oder Appenzell nehmen (Verbindungen im Vorfeld abklären)\noder Sie reservieren den praktischen PubliCar (Rufbus) via App oder Tel. 0848 55 30 60."
  },
  {
    "id": "8008fbbf",
    "title": "ÜBER ZWEI BRÜCKEN DURCH DAS ROTBACHTOBEL",
    "description": "Kloster Wonnenstein – Rotbach – Ausgangspunkt des Rundwanderweges ist die Wallfahrtskirche «Maria Hilf» in Haslen. Nach dem Dorfplatz ge- hen Sie linker Hand auf einem Wiesenweg, vorbei an verschiedenen traditionellen Bauernhäusern. Am Wald- rand bei der Liegenschaft Auen verzweigt sich der Weg und Sie steigen ab zum Zusammenfluss von Sitter und Rotbach, wo Sie zum idyllischen Badeplatz «Strom» im Grenzgebiet der Kantone Al und AR gelangen. Der Weg",
    "region": "Appenzell",
    "duration": "2 Stunden 45 Minuten",
    "distance": "8.89 km",
    "elevation_gain": "352m",
    "elevation_loss": "352m",
    "restaurants": [
      "Restaurant Linde",
      "Restaurant Krone"
    ],
    "sac_scale": "T2",
    "highlights": [],
    "source_pdf": "Appenzell_Wanderungen.pdf",
    "page_number": 14,
    "raw_text": "--- Seite 14 ---\nTAL- UND HÜGELWEGE\n14\nÜBER ZWEI BRÜCKEN DURCH DAS ROTBACHTOBEL\nHaslen – Braunbüel – Auen –\nBadeplatz Strom – Gmünden –\nKloster Wonnenstein – Rotbach –\nHinterhaslen – Hüsli – Haslen\n2 Stunden 45 Minuten\nRestaurant Linde,\nRestaurant Krone\n8.89 km 352 m 352 m\nSAC-Wanderskala\nT 2\nAusgangspunkt des Rundwanderweges ist die Wallfahrtskirche «Maria Hilf» in Haslen. Nach dem Dorfplatz ge-\nhen Sie linker Hand auf einem Wiesenweg, vorbei an verschiedenen traditionellen Bauernhäusern. Am Wald-\nrand bei der Liegenschaft Auen verzweigt sich der Weg und Sie steigen ab zum Zusammenfluss von Sitter und\nRotbach, wo Sie zum idyllischen Badeplatz «Strom» im Grenzgebiet der Kantone Al und AR gelangen. Der Weg\nführt über den Rotbach und hangaufwärts vorbei an der Strafanstalt in Richtung Teufen. Nachdem das Kapuzi-\nnerinnenkloster Wonnenstein (eine Innerrhoder Exklave) passiert ist, wandern Sie geradeaus und steigen auf\neinem kreativ angelegten Eisentreppen-Pfad ab zum Höchfall. Dort stürzt das Wasser über eine mehr als 20m\nhohe Standsteinstufe in die Tiefe. Nach dem Rückweg die Stufen hinauf, unterqueren Sie zwei Mal die Auto-\nstrasse und steigen erneut ab zum Rotbach, um ihn diesmal zu überqueren. Auf der anderen Bachseite – wieder\nim Kanton AI – steigt der Weg an nach Hinterhaslen. Bei der zweiten Verzweigung biegen Sie links ab, überque-\nren die Hauptstrasse und folgen dieser, bis der Weg durch ein Waldstück zum wunderschönen Bildstöckli\nSt. Wendelin führt. Haslen ist nun in Sichtweite und geradeaus erreichen Sie den Ausgangspunkt.\nTipp: Wegen der Eisengittertreppen ist der Abstecher zum Höchfall für Hunde weniger geeignet. Bade- und\nBrätelsachen nicht vergessen!"
  },
  {
    "id": "f97c52cb",
    "title": "SÄNTISBLICK-RUNDWEG SCHLATT",
    "description": "Auf dem Säntisblick Rundweg mit Ausgangspunkt Schlatt ist alles vereint, was die Appenzeller Landschaft ausmacht. Die sanften Hügel rund um Schlatt sind ausserdem sonnenverwöhnt. Start und Ziel der Wanderung ist die Kirche St. Josef von Schlatt. Die Route führt auf dem Strässchen Richtung Leimensteig. Bei der ersten Rechtskurve zweigt der Weg links, hangabwärts ab. Bald ist der tiefste Punkt des Rundweges erreicht. Nun folgen Sie dem schmalen Weg schönen Hecken entlang hinauf zur Strasse.",
    "region": "Appenzell",
    "duration": "2 Stunden 45 Minuten",
    "distance": "6.55 km",
    "elevation_gain": "221m",
    "elevation_loss": "221m",
    "restaurants": [
      "Gasthaus Bären Schlatt",
      "Gasthaus Leimensteig",
      "Gasthaus Bären zur Einkehr"
    ],
    "sac_scale": "T2",
    "highlights": [
      "Alpstein",
      "Säntis",
      "Alp"
    ],
    "source_pdf": "Appenzell_Wanderungen.pdf",
    "page_number": 15,
    "raw_text": "--- Seite 15 ---\n15\nSÄNTISBLICK-RUNDWEG SCHLATT\nSchlatt – Leimensteig –\nSteigershus – Saul – Schlatt\n2 Stunden 45 Minuten\nGasthaus Bären Schlatt,\nGasthaus Leimensteig\n6.55 km 221 m 221 m\nSAC-Wanderskala\nT 2\nAuf dem Säntisblick Rundweg mit Ausgangspunkt Schlatt ist alles vereint, was die Appenzeller Landschaft\nausmacht. Die sanften Hügel rund um Schlatt sind ausserdem sonnenverwöhnt. Start und Ziel der Wanderung\nist die Kirche St. Josef von Schlatt. Die Route führt auf dem Strässchen Richtung Leimensteig. Bei der ersten\nRechtskurve zweigt der Weg links, hangabwärts ab. Bald ist der tiefste Punkt des Rundweges erreicht. Nun\nfolgen Sie dem schmalen Weg schönen Hecken entlang hinauf zur Strasse. Für eine Rast lohnt sich hier der\nAbstecher zum Gasthaus Leimensteig (ca. 150m links). Die Route führt Sie nun kurz auf dem Strässchen Rich-\ntung Schlatt und verlässt dieses, um auf den Hügel zuzuhalten. Ist die Krete beim Saul erreicht, öffnet sich der\nBlick südwärts zum Alpsteinmassiv und auf die vorgelagerten Hügel und Dörfer. Nun folgt ein gemütlicher\nAbschnitt auf dem Strässchen sanft abwärts in Richtung Schlatt bis ein schmaler Pfad rechts über die Wiese\nabzweigt und der Flanke entlangführt. Sie erkennen bereits die Kirche von Schlatt und es lockt das Gasthaus\nBären zur Einkehr.\nTipp: An nebligen Herbsttagen wandern Sie auf dieser Tour meist mit nichts als Sonnenstrahlen im Gesicht."
  },
  {
    "id": "19c989dd",
    "title": "ABSEITS VOM ALLTAG",
    "description": "Beim Bahnhof Weissbad starten Sie in südwestlicher Richtung vorbei am Hotel Hof Weissbad. Überqueren Sie den Wissbach und folgen Sie dem Pfad links hinauf in Richtung Sonnenhalb. Sobald die oft besuchte Kapelle Sieben Schmerzen Mariens («Sonnehalbchappeli») in Ihr Blickfeld gerät, schwenken Sie rechts ab und wandern, zuerst noch auf der Flurstrasse, später auf schattigen Waldwegen bis zur malerischen Ahorn-Kapelle.",
    "region": "Appenzell",
    "duration": "4 Stunden",
    "distance": "13.19 km",
    "elevation_gain": "563m",
    "elevation_loss": "563m",
    "restaurants": [
      "Gasthaus Ahorn",
      "Gasthaus Lehmen",
      "Berggasthaus Ahorn"
    ],
    "sac_scale": "T2",
    "highlights": [
      "Aussicht",
      "Alpstein",
      "Alp"
    ],
    "source_pdf": "Appenzell_Wanderungen.pdf",
    "page_number": 16,
    "raw_text": "--- Seite 16 ---\nTAL- UND HÜGELWEGE\n16\nABSEITS VOM ALLTAG\nWeissbad – Rechböhl –\nSonnenhalb – Ahorn –\nLeuenfall – Lehmen – Eugst –\nSonnenhalb – Weissbad\n4 Stunden\nHotel Hof Weissbad, Garni Loos-\nmühle, Hotel Belvedere,\nBerggasthaus Ahorn,\nWaldgasthaus Lehmen\n13.19 km 563 m 563 m\nSAC-Wanderskala\nT 2\nBerggasthaus Ahorn\nBeim Bahnhof Weissbad starten Sie in südwestlicher Richtung vorbei am Hotel Hof Weissbad. Überqueren Sie\nden Wissbach und folgen Sie dem Pfad links hinauf in Richtung Sonnenhalb. Sobald die oft besuchte Kapelle\nSieben Schmerzen Mariens («Sonnehalbchappeli») in Ihr Blickfeld gerät, schwenken Sie rechts ab und wandern,\nzuerst noch auf der Flurstrasse, später auf schattigen Waldwegen bis zur malerischen Ahorn-Kapelle. Die schöne\nWallfahrtskapelle, das heimelige Gasthaus und die Aussicht auf die mächtigen Nordwände des Alpsteins lassen\nSie so schnell nicht weiterziehen.\nDer Rückweg führt abwärts zum Wissbach. Dort lohnt sich ein Abstecher zum nahen Leuenfall, wo sich der\nBerndlibach schäumend in die Tiefe stürzt. Bald danach erreichen Sie das Waldgasthaus Lehmen. Folgen Sie der\nStrasse knapp 500 m talauswärts bis zum Bauernhof Eugst, wo Sie links über Wiesland auf den Waldrand zuhal-\nten und am tiefsten Punkt den Wissbach erneut überqueren. Schon bald erreichen Sie die erwähnte, idyllische\nKapelle in Sonnenhalb und auf dem bereits bekannten Weg ziehen Sie dem Ziel Weissbad entgegen.\nSimone Codoni\n9057 Weissbad\nTel. +41 71 799 12 21\ninfo@ahorn.ch\nwww.ahorn.ch\nMai bis Oktober: Fr. bis Mi.\nNovember bis April: Fr. bis Mo.\n1015 m ü. M."
  },
  {
    "id": "6fb511cf",
    "title": "ABWECHSLUNGSREICHE GRATWANDERUNG AUF DEN KRONBERG",
    "description": "Garni Loosmühle, Hotel Belvedere, Über saftig grüne Wiesen führt der schmale Weg ab Weissbad hinauf zum Rechböhl und weiter im schattigen Wald aufwärts bis auf den Klosterspitz, einem auch bei vielen Einheimischen sehr gerne besuchten Aussichts- punkt. In einen weiten Talkessel gebettet, liegt nördlich das Dorf Appenzell, gegen Südosten blicken Sie hinab ins liebliche Schwendetal. Vorbei an den Hütten der Neuenalp führt der Weg weiter durch ein landschaftlich",
    "region": "Appenzell",
    "duration": "4 Stunden",
    "distance": "9.83 km",
    "elevation_gain": "1008m",
    "elevation_loss": "176m",
    "restaurants": [
      "Gasthaus Scheidegg",
      "Gasthaus Kronberg",
      "Hütte und Stall der"
    ],
    "sac_scale": "T2",
    "highlights": [
      "Aussicht",
      "Säntis",
      "Ebenalp",
      "Alp"
    ],
    "source_pdf": "Appenzell_Wanderungen.pdf",
    "page_number": 17,
    "raw_text": "--- Seite 17 ---\n17\nABWECHSLUNGSREICHE GRATWANDERUNG AUF DEN KRONBERG\nWeissbad – Rechböhl –\nKlosterspitz – Neuenalp –\nWasserschaffen – Scheidegg –\nKronberg\n4 Stunden\nHotel Hof Weissbad,\nGarni Loosmühle, Hotel Belvedere,\nBerggasthaus Scheidegg,\nBerggasthaus Kronberg\n9.83 km 1008 m 176 m\nSAC-Wanderskala\nT 2+\nBerggasthaus Scheidegg\nÜber saftig grüne Wiesen führt der schmale Weg ab Weissbad hinauf zum Rechböhl und weiter im schattigen\nWald aufwärts bis auf den Klosterspitz, einem auch bei vielen Einheimischen sehr gerne besuchten Aussichts-\npunkt. In einen weiten Talkessel gebettet, liegt nördlich das Dorf Appenzell, gegen Südosten blicken Sie hinab\nins liebliche Schwendetal. Vorbei an den Hütten der Neuenalp führt der Weg weiter durch ein landschaftlich\nhöchst wertvolles Hochmoor von nationaler Bedeutung mit malerischer Feuerstelle. Anschliessend wandern\nSie zu den Alpen der Vorderen und der Hinteren Wasserschaffen. Lassen Sie den Blick nördlich zur mächtigen\nSäntiskette mit Ebenalp, Schäfler, Altenalptürmen, Öhrli und Säntis schweifen. Vorbei an Hütte und Stall der\nAlp Blatten erreichen Sie das Berggasthaus Scheidegg. Gönnen Sie sich eine typische Appenzeller Spezialität\nin der heimeligen Gaststube oder auf der herrlichen Terrasse, bevor Sie den letzten Anstieg in Angriff neh-\nmen. Das letzte Wegstück führt vorbei an der besonders schön gelegenen Kapelle St. Jakob hinauf auf den\nKronberg. Hinab ins Tal nach Jakobsbad bringt Sie knieschonend und elegant die Luftseilbahn.\nDaniela Frommenwiler und\nRuedi Zürcher\n9108 Gonten\nTel. +41 71 794 11 20\ninfo@scheidegg-ai.ch\nwww.scheidegg-ai.ch\nMai bis November, im Winter\nje nach Witterung, siehe Webseite\n40 Matratzenlager\n1352 m ü. M."
  },
  {
    "id": "95bf0e14",
    "title": "«RONDOM KAU»",
    "description": "Das Hotel Kaubad im Rücken erreichen Sie nach wenigen Metern die idyllischen, kürzlich renaturierten Wei- her, die zu einer ersten Pause einladen. Der Weg folgt dem Ufer des grössten Weihers und bald lockt die Ruhe- bank beim besonders schön gelegenen Kaukreuz zum nächsten Innehalten. Nach ein paar Schritten im Wald, gelangen Sie in das weitläufige Gebiet «Hinterkau» mit seinen verstreuten Höfen.",
    "region": "Appenzell",
    "duration": "1 Stunde 30 Minuten",
    "distance": "4.69 km",
    "elevation_gain": "189m",
    "elevation_loss": "189m",
    "restaurants": [
      "Gasthof Eischen"
    ],
    "sac_scale": "T1",
    "highlights": [
      "Aussicht"
    ],
    "source_pdf": "Appenzell_Wanderungen.pdf",
    "page_number": 21,
    "raw_text": "--- Seite 21 ---\n21\n«RONDOM KAU»\nBitte folgen Sie den\nweissen Wegweisern «Rondom\nKau». Der Weg kann in beide\nRichtungen begangen werden.\n1 Stunde 30 Minuten\nLandgasthof Eischen,\nHotel Kaubad\n4.69 km 189 m 189 m\nSAC-Wanderskala\nT 1\nGrün in allen Schattierungen\nDas Hotel Kaubad im Rücken erreichen Sie nach wenigen Metern die idyllischen, kürzlich renaturierten Wei-\nher, die zu einer ersten Pause einladen. Der Weg folgt dem Ufer des grössten Weihers und bald lockt die Ruhe-\nbank beim besonders schön gelegenen Kaukreuz zum nächsten Innehalten. Nach ein paar Schritten im Wald,\ngelangen Sie in das weitläufige Gebiet «Hinterkau» mit seinen verstreuten Höfen. Höhe verlierend gewinnen\nSie dafür Aussicht und der diesbezügliche Höhepunkt ist bei der idyllischen Kapelle St. Georg Hinterkau er-\nreicht. Über die gepflegten Wiesen geht es abwärts und kurz oberhalb des Waldrands biegen Sie rechts ab und\nsteigen zum Kaubach ab. Durch eine Waldlichtung wandern Sie aufwärts, wo Sie dem Waldrand entlang und\ndurch ein ziemlich farbiges Wohnquartier die Kaustrasse erreichen, welche Sie überqueren und im lichten\nWald aufsteigend zum Campingplatz gelangen. Nach den letzten Wohnwagen biegen Sie aufwärts ab auf die\nWiese (Weg nicht verlassen, Gras nicht zertrampeln) und vorbei an zwei typischen Bauernhäusern gelangen\nSie zurück zum Ausgangspunkt.\nTipp: Die kürzlich renaturierten Kauweiher mit Brätelstelle und Froschkonzert (im Frühling)."
  },
  {
    "id": "805be37d",
    "title": "«RONDOM GONTE»",
    "description": "Das Gontner Hochtal aus allen Perspektiven Folgen Sie vom Gontner Bahnhof den Gleisen in Richtung Appenzell und überqueren Sie diese beim ersten Bahnübergang. Vorbei an einem Freilaufstall überqueren Sie schon bald den Bach «Schwarz» und halten gerade- aus auf den Hügel zu. Bei der Liegenschaft «Sömmerli» wenden Sie sich nach rechts und spazieren die nächsten Meter mit oder ohne Schuhe auf dem Barfussweg. Nach einem kurzen Stück auf der Flurstrasse verlassen Sie",
    "region": "Appenzell",
    "duration": "1 Stunde 15 Minuten",
    "distance": "4.24 km",
    "elevation_gain": "193m",
    "elevation_loss": "193m",
    "restaurants": [
      "Café Rössli"
    ],
    "sac_scale": "T1",
    "highlights": [],
    "source_pdf": "Appenzell_Wanderungen.pdf",
    "page_number": 23,
    "raw_text": "--- Seite 23 ---\n23\n«RONDOM GONTE»\nBitte folgen Sie den weissen\nWegweisern «Rondom Gonte».\nDer Weg kann in beide\nRichtungen begangen werden.\n1 Stunde 15 Minuten\nCafé Rössli, Krone,\nBären, Löwen\n4.24 km 193 m 193 m\nSAC-Wanderskala\nT 1\nDas Gontner Hochtal aus allen Perspektiven\nFolgen Sie vom Gontner Bahnhof den Gleisen in Richtung Appenzell und überqueren Sie diese beim ersten\nBahnübergang. Vorbei an einem Freilaufstall überqueren Sie schon bald den Bach «Schwarz» und halten gerade-\naus auf den Hügel zu. Bei der Liegenschaft «Sömmerli» wenden Sie sich nach rechts und spazieren die nächsten\nMeter mit oder ohne Schuhe auf dem Barfussweg. Nach einem kurzen Stück auf der Flurstrasse verlassen Sie\ndiese und gehen auf dem Wiesenweg bis Sie die Gleise überqueren und sich nach links wenden. Auf der anderen\nSeite der Hauptstrasse folgen Sie der Flurstrasse hangaufwärts vorbei am Mehrzweckgebäude. Bei der zweiten\nMöglichkeit, biegen Sie rechts auf das schmale Strässchen ab und folgen diesem den Hang querend bis auf die\nHügelkrete. Dort treffen Sie auf den Wanderweg und folgen ihm abwärts, wo Sie nach ein paar Metern wieder im\nDorfzentrum, vis-à-vis der Kirche, landen.\nTipp: Besonders schön in den frühen Morgenstunden, wenn Gonten in den Genuss der ersten Sonnenstrahlen\nkommt."
  },
  {
    "id": "b86accae",
    "title": "«RONDOM SCHLATT»",
    "description": "Schlatt». Der Weg kann in beide Sonne und Aussicht, Wanderherz was willst du mehr! Erholung pur erwartet Sie auf diesem gemütlichen Panoramaspaziergang, der bei der Schlatter Kirche beginnt und nach wenigen Metern auf den Kiesweg direkt vor dem Gasthaus Bären mit seiner schönen Aussichtster- rasse einbiegt. Der Kiesweg wird schon bald zum Wiesenweg, der zur Gehrenbergstrasse führt. Hier geniessen",
    "region": "Appenzell",
    "duration": "",
    "distance": "2.40 km",
    "elevation_gain": "103m",
    "elevation_loss": "103m",
    "restaurants": [
      "Gasthaus Bären Schlatt",
      "Gasthaus Bären mit seiner schönen Aussichtster-"
    ],
    "sac_scale": "T1",
    "highlights": [
      "Aussicht",
      "Panorama",
      "Alpstein",
      "Säntis"
    ],
    "source_pdf": "Appenzell_Wanderungen.pdf",
    "page_number": 25,
    "raw_text": "--- Seite 25 ---\n25\n«RONDOM SCHLATT»\nBitte folgen Sie den\nweissen Wegweisern «Rondom\nSchlatt». Der Weg kann in beide\nRichtungen begangen werden.\n45 Minuten\nGasthaus Bären Schlatt\n2.40 km 103 m 103 m\nSAC-Wanderskala\nT 1\nSonne und Aussicht, Wanderherz was willst du mehr!\nErholung pur erwartet Sie auf diesem gemütlichen Panoramaspaziergang, der bei der Schlatter Kirche beginnt\nund nach wenigen Metern auf den Kiesweg direkt vor dem Gasthaus Bären mit seiner schönen Aussichtster-\nrasse einbiegt. Der Kiesweg wird schon bald zum Wiesenweg, der zur Gehrenbergstrasse führt. Hier geniessen\nSie ein vorläufig letztes Mal die Aussicht ins Gebiet Gehrenberg-Saul mit seinen verstreuten Höfen und ge-\npflegten Wiesen. Auf der Flurstrasse – die ganze Alpsteinpracht von Kamor bis Säntis stets im Blick – wandern\nSie nun sanft talwärts und passieren dabei mehrere typische Liegenschaften. Schon bald biegen Sie nach\nrechts auf den Wiesenweg ab und gelangen nach wenigen, steilen Metern zu einem kleinen Waldstück. Gehen\nSie um die Geländekante herum und freuen Sie sich am perfekt platzierten Bänkli und der idyllischen Sicht\nauf Schlatt. Vorbei an der Liegenschaft «Stockerers» erreichen Sie nach wenigen Metern auf der Strasse wieder\ndie Kirche St. Josef und das Ende des Rundwegs.\nTipp: Wenn im Herbst der Nebel über dem Talboden liegt, geniesst man in Schlatt Sonne pur."
  },
  {
    "id": "f1dbe927",
    "title": "«RONDOM EGGESTANDE»",
    "description": "So viel Aussicht in so kurzer Zeit! und Altes Bild, biegen Sie beim Schützenstand links ab und lassen schon bald die letzten Häuser des Quartiers hinter sich. Schritt für Schritt tut sich der Blick auf über die ehemals moorige Hochebene von Eggerstanden und der Alpstein baut sich im Hintergrund mächtig auf. Der Blick ändert sich nur wenig, nachdem Sie sich gegen rechts wenden und ein kurzes Stück der Strasse fol-",
    "region": "Appenzell",
    "duration": "1 Stunde",
    "distance": "3.35 km",
    "elevation_gain": "95m",
    "elevation_loss": "95m",
    "restaurants": [
      "Restaurant s Neues",
      "Gasthaus Neues Bild",
      "Wirtschaft Altes Bild"
    ],
    "sac_scale": "T1",
    "highlights": [
      "Aussicht",
      "Alpstein",
      "Alp",
      "Hochebene"
    ],
    "source_pdf": "Appenzell_Wanderungen.pdf",
    "page_number": 27,
    "raw_text": "--- Seite 27 ---\n27\n«RONDOM EGGESTANDE»\nBitte folgen Sie den\nweissen Wegweisern «Rondom\nEggestande». Der Weg kann in\nbeide Richtungen begangen\nwerden.\n1 Stunde\nLandgasthaus Neues Bild,\nWirtschaft Altes Bild\n3.35 km 95 m 95 m\nSAC-Wanderskala\nT 1\nSo viel Aussicht in so kurzer Zeit!\nMit der modernen Eggerstandner Kirche St. Josef im Rücken vorbei (oder hinein) an den Restaurants Neues\nund Altes Bild, biegen Sie beim Schützenstand links ab und lassen schon bald die letzten Häuser des Quartiers\nhinter sich. Schritt für Schritt tut sich der Blick auf über die ehemals moorige Hochebene von Eggerstanden\nund der Alpstein baut sich im Hintergrund mächtig auf.\nDer Blick ändert sich nur wenig, nachdem Sie sich gegen rechts wenden und ein kurzes Stück der Strasse fol-\ngen. Diese verlassen Sie schon bald und halten hangaufwärts, vorbei an mehreren verstreuten Bauernliegen-\nschaften. Bei der ersten Möglichkeit folgen Sie dem Weg hangabwärts über Wiesen und gelangen zur Eich-\nbergstrasse. Diese verlassen Sie schon bald nach rechts und überqueren am tiefsten Punkt der Wanderung den\nnoch jungen Auerbach. Auf einem Strässchen gelangen Sie in kurzer Zeit zurück zum Ausgangspunkt.\nTipp: Besonders schön im Abendlicht und bei Sonnenuntergang, wenn der Alpstein rötlich leuchtet."
  },
  {
    "id": "a06becca",
    "title": "«RONDOM S WISSBAD»",
    "description": "Weissbads schönste Aussichtspunkte Vom Startpunkt beim Bahnhof Weissbad biegen Sie direkt hinter dem Hotel Hof Weissbad links in den Wald ab. Nach einer kurzen, angenehmen Steigung erreichen Sie offenes Wiesengelände und schon bald die herzige Lie- genschaft «Dürrnäsli». Der Wanderweg quert weitere Wiesen und Sie erreichen nach dem stattlichen und bis im Herbst blumengeschmückten Bauernhaus «Schnidermartissepes» die Triebernstrasse, der Sie bis zur nächsten",
    "region": "Appenzell",
    "duration": "1 Stunde 30 Minuten",
    "distance": "4.81 km",
    "elevation_gain": "188m",
    "elevation_loss": "188m",
    "restaurants": [
      "Alp enblick"
    ],
    "sac_scale": "T1",
    "highlights": [
      "Aussicht",
      "Alp"
    ],
    "source_pdf": "Appenzell_Wanderungen.pdf",
    "page_number": 29,
    "raw_text": "--- Seite 29 ---\n29\n«RONDOM S WISSBAD»\nBitte folgen Sie den\nweissen Wegweisern «Rondom\ns Wissbad». Der Weg kann in\nbeide Richtungen begange\nwerden.\n1 Stunde 30 Minuten\nHof Weissbad, Edelweiss,\nAlpenblick, Frohe Aussicht,\nBelvedere, Loosmühle\n4.81 km 188 m 188 m\nSAC-Wanderskala\nT 1\nWeissbads schönste Aussichtspunkte\nVom Startpunkt beim Bahnhof Weissbad biegen Sie direkt hinter dem Hotel Hof Weissbad links in den Wald ab.\nNach einer kurzen, angenehmen Steigung erreichen Sie offenes Wiesengelände und schon bald die herzige Lie-\ngenschaft «Dürrnäsli». Der Wanderweg quert weitere Wiesen und Sie erreichen nach dem stattlichen und bis im\nHerbst blumengeschmückten Bauernhaus «Schnidermartissepes» die Triebernstrasse, der Sie bis zur nächsten\nKurve folgen und dort dem Hang entlang Richtung Schwendner Kirche St. Martin mit dem eleganten\nKirchturm-Hut weiterwandern. Ein Abstecher zur Kirche lohnt sich, denn der Rondom-Weg zweigt vorher ab\nund quert die Talstrasse nach ein paar Schritten am Schwendebach. Am Gegenhang geht es hinauf über Wie-\nsengrund mit Blick zum Hohen Kasten und bald ein kurzes Stück der Strasse entlang, bevor der Rundweg dem\nWaldrand entlang hoch über dem Chlustobel zu Weissbads Wohnquartieren und dem Bahnhof zurückkehrt.\nTipp: Der Kräutergarten beim Hof Weissbad und die besonders schöne Ruhebank bei der Liegenschaft «Egg»\nnahe der Triebernstrasse mit Blick über das ganze Schwendetal."
  },
  {
    "id": "246a9d93",
    "title": "BERGWANDERUNGEN",
    "description": "Diese Bergwanderung startet bei der Kirche in Brülisau und verläuft zuerst auf dem Strässchen mit direktem Blick zum Tagesziel, dem Hohen Kasten. Bereits nach 100 Metern zweigt der Weg nach links ab. Nachdem Sie den Horstbach überquert haben, führt der Pfad zuerst idyllisch dem Bach entlang und dann über Wiesen und durch ein Hochmoor bis zur Alp Fulen. Von dort geht es weiter via Berggasthaus Ruhesitz und ohne grössere Steigungen bis zur Alp Soll.",
    "region": "Appenzell",
    "duration": "3 Stunden 15 Minuten",
    "distance": "7.80 km",
    "elevation_gain": "938m",
    "elevation_loss": "76m",
    "restaurants": [
      "Restaurant Hoher Kasten",
      "Restaurant und Seilbahn",
      "Gasthaus Rössli"
    ],
    "sac_scale": "T2",
    "highlights": [
      "Aussicht",
      "Alp"
    ],
    "source_pdf": "Appenzell_Wanderungen.pdf",
    "page_number": 42,
    "raw_text": "--- Seite 42 ---\nBERGWANDERUNGEN\n4422\nIM ZICKZACK HOCH ZUM HOHEN KASTEN\nBrülisau – Waldschaft –\nAlp Fulen – Ruhesitz –\nAlp Soll – Wenneli –\nKastensattel – Hoher Kasten\n3 Stunden 15 Minuten\nGasthaus Rössli,\nBerggasthaus Ruhesitz,\nDrehrestaurant Hoher Kasten\n7.80 km 938 m 76 m\nSAC-Wanderskala\nT 2\nSeilbahn Hoher Kasten\nDiese Bergwanderung startet bei der Kirche in Brülisau und verläuft zuerst auf dem Strässchen mit direktem\nBlick zum Tagesziel, dem Hohen Kasten. Bereits nach 100 Metern zweigt der Weg nach links ab. Nachdem Sie\nden Horstbach überquert haben, führt der Pfad zuerst idyllisch dem Bach entlang und dann über Wiesen und\ndurch ein Hochmoor bis zur Alp Fulen. Von dort geht es weiter via Berggasthaus Ruhesitz und ohne grössere\nSteigungen bis zur Alp Soll. Ist das liebliche Alpgebiet mit den verstreuten Hütten erreicht, steigt der Weg wie-\nder an. Nicht ohne das Vergiessen einiger Schweisstropfen, gelangen Sie nach ein paar Zickzack-Kurven am\ntiefsten Punkt des Grates, dem «Wenneli», auf den Höhenweg Hoher Kasten-Staubern. Diesem entlang wan-\ndern Sie bis zum Kastensattel. Stets das Ziel vor Augen, folgt ein kurzer und knackiger Schlussaufstieg mit ein\npaar weiteren Kurven im Zickzack. Angekommen auf dem Appenzeller Aussichtsberg, dürfen Sie den Europa-\nRundweg keinesfalls verpassen. Auf dieser kurzen, lohnenswerten Zusatzschlaufe erwartet Sie nämlich «ron-\ndom» nichts als Aussicht – was für eine Belohnung!\nHoher Kasten\nDrehrestaurant und Seilbahn\n9058 Brülisau\nTel. +41 71 799 13 22\ninfo@hoherkasten.ch\nwww.hoherkasten.ch\nApril bis Februar\n1794 m ü. M."
  },
  {
    "id": "a03ca2e2",
    "title": "TRAUM-PANORAMA AUF DEM NORDÖSTLICHSTEN GIPFEL DER WESTALPEN",
    "description": "Die Seilbahn bringt Sie bequem ab Brülisau in die Höhe und schon werden Sie verwöhnt: Eine prächtige 360-Grad-Sicht bietet einen Blick auf die Alpsteinketten, hinaus ins Appenzellerland, ins St. Galler Rheintal und auf die Vorarlberger und Allgäuer Alpen. Auf dem gut ausgebauten Bergweg geht es in angenehmem Gefälle hin- über zum markanten Nachbargipfel, dem Kamor. Bereits nach wenigen Kurven auf dem Strässchen kürzen Sie ab über Alpweiden hinab zum Zapfen.",
    "region": "Appenzell",
    "duration": "2 Stunden 30 Minuten",
    "distance": "8.11 km",
    "elevation_gain": "115m",
    "elevation_loss": "977m",
    "restaurants": [
      "Restaurant Hoher Kasten",
      "Gasthaus Rössli",
      "Alp EN"
    ],
    "sac_scale": "T2",
    "highlights": [
      "Panorama",
      "Gipfel",
      "See",
      "Alpstein"
    ],
    "source_pdf": "Appenzell_Wanderungen.pdf",
    "page_number": 43,
    "raw_text": "--- Seite 43 ---\n43\nTRAUM-PANORAMA AUF DEM NORDÖSTLICHSTEN GIPFEL DER WESTALPEN\nHoher Kasten (Seilbahn) –\nKamor – Zapfen – Resspass –\nHintere Waldschaft – Brülisau\n2 Stunden 30 Minuten\nDrehrestaurant Hoher Kasten,\nGasthaus Rössli\n8.11 km 115 m 977 m\nSAC-Wanderskala\nT 2\nDrehrestaurant Hoher Kasten\nDie Seilbahn bringt Sie bequem ab Brülisau in die Höhe und schon werden Sie verwöhnt: Eine prächtige\n360-Grad-Sicht bietet einen Blick auf die Alpsteinketten, hinaus ins Appenzellerland, ins St. Galler Rheintal und\nauf die Vorarlberger und Allgäuer Alpen. Auf dem gut ausgebauten Bergweg geht es in angenehmem Gefälle hin-\nüber zum markanten Nachbargipfel, dem Kamor. Bereits nach wenigen Kurven auf dem Strässchen kürzen Sie\nab über Alpweiden hinab zum Zapfen. Ein idyllischer Gegenanstieg über Magerwiesen führt Sie zum Resspass.\nVon hier aus lohnt sich ein kurzer Abstecher zum Forstseeli (S. 8). Zurück auf der Route, folgen Sie dem Pfad in\nRichtung Hintere Waldschaft. Je nach Vegetationsstand stösst man in diesem Gebiet auf einen Teppich von\nblauem Enzian, «Hennenäugli» und sogar der Frauenschuh blüht hier. Über Weiden, vorbei an verstreuten Bau-\nernhäusern traditioneller Bauart, wandern Sie – den Alpstein stets vor Augen – hinab bis nach Brülisau.\nTipp: Auf Blumenliebhaber wartet auf dem Gipfel ein 5000 m2 grosser, sorgsam gepflegter Alpengarten mit präch-\ntiger Alpsteinflora.\nUrs Brülisauer\nDrehrestaurant Hoher Kasten\n9058 Brülisau\nTel. +41 71 799 11 17\ndrehrestaurant@hoherkasten.ch\nwww.hoherkasten.ch\nApril bis Februar\n1794 m ü. M."
  },
  {
    "id": "5a113f1d",
    "title": "ENTLANG DES SCHÖNSTEN AUSSICHTSGRATS",
    "description": "Die ersten Meter auf den Hohen Kasten überwinden Sie bequem mit der Seilbahn. Oben angekommen, emp- fiehlt sich ein Zwischenstopp im Alpengarten und ein Warmlaufen auf dem spektakulären Europa-Rundweg. Bis zum Berggasthaus Staubern liegt eine beeindruckende Gratwanderung in stetem Auf und Ab vor Ihnen: Geniessen Sie die Alpsteinsicht, die Tiefblicke ins Rheintal und die Weitblicke in die schweizerische und die österreichische Alpenwelt.",
    "region": "Appenzell",
    "duration": "4 Stunden 15 Minuten",
    "distance": "12.79 km",
    "elevation_gain": "429m",
    "elevation_loss": "1291m",
    "restaurants": [
      "Restaurant Hoher Kasten",
      "Gasthaus Staubern",
      "Gasthaus Ruhesitz"
    ],
    "sac_scale": "T2",
    "highlights": [
      "Aussicht",
      "See",
      "Alpstein",
      "Alp"
    ],
    "source_pdf": "Appenzell_Wanderungen.pdf",
    "page_number": 45,
    "raw_text": "--- Seite 45 ---\n45\nENTLANG DES SCHÖNSTEN AUSSICHTSGRATS\nHoher Kasten (Seilbahn) –\nStaubern – Rainhütten –\nAlp Soll – Ruhesitz – Brülisau\n4 Stunden 15 Minuten\nDrehrestaurant Hoher Kasten,\nBerggasthaus Staubern,\nBerggasthaus Ruhesitz,\nGasthaus Rössli\n12.79 km 429 m 1291 m\nSAC-Wanderskala\nT 2\nBerggasthaus Staubern\nDie ersten Meter auf den Hohen Kasten überwinden Sie bequem mit der Seilbahn. Oben angekommen, emp-\nfiehlt sich ein Zwischenstopp im Alpengarten und ein Warmlaufen auf dem spektakulären Europa-Rundweg.\nBis zum Berggasthaus Staubern liegt eine beeindruckende Gratwanderung in stetem Auf und Ab vor Ihnen:\nGeniessen Sie die Alpsteinsicht, die Tiefblicke ins Rheintal und die Weitblicke in die schweizerische und die\nösterreichische Alpenwelt. Auf diesem Wegabschnitt sind Sie ausserdem auf dem geologischen Wanderweg\nunterwegs. Thementafeln stellen den unmittelbaren Bezug zur Umgebung her und erklären die Geologie ein-\nfach und verständlich. Gönnen Sie sich nach der ersten Streckenhälfte im Berggasthaus Staubern eine Stär-\nkung. Im Zickzack wird anschliessend der Abstieg zur Alp Rainhütten angenehm bewältigt. Hier lohnt sich\nein Besuch der Alpkäserei, um ein Stück Rainhütten-Käse für zu Hause einzukaufen. Weiter führt der Weg\ndurch den Wald oberhalb des Sämtisersees und über die Wiesen der Alp Soll bis zum Berggasthaus Ruhesitz.\nDen letzten Abschnitt nach Brülisau können Sie zu Fuss oder mit einem Trottinett zurücklegen.\nFamilie Lüchinger-Zehnder\n9467 Frümsen\nTel. Sommer +41 81 757 24 24\nTel. Winter +41 79 411 49 65\nstaubern@bluewin.ch\nwww.staubern.ch\nMai bis November\n45 Betten\n1751 m ü. M."
  },
  {
    "id": "9403cbe3",
    "title": "SPEKTAKULÄRE KRETE, WUNDERBARE BELOHNUNG",
    "description": "Anfangs gemächlich, später ziemlich steil verläuft der Anstieg von Brülisau über die farbigen Magerwiesen der Rossweid zum Chehr, zur Alp Bärstein und schliesslich an den Wandfuss der Sigelwand. Hinauf geht es fast senkrecht durch die spektakuläre, mit Drahtseilen versicherte Zahme Gocht. Von unten wirkt sie unbezwingbar, dafür ist es oben umso schöner! Ist die Felskante der Alp Sigel erklommen, eröffnet sich eine einmalige Aussicht auf die umliegende Bergwelt.",
    "region": "Appenzell",
    "duration": "3 Stunden 45 Minuten",
    "distance": "8.32 km",
    "elevation_gain": "763m",
    "elevation_loss": "763m",
    "restaurants": [
      "Gasthaus Rössli",
      "Gasthaus Plattenbödeli",
      "Berggasthaus Plattenbödeli"
    ],
    "sac_scale": "T3",
    "highlights": [
      "Aussicht",
      "Alp"
    ],
    "source_pdf": "Appenzell_Wanderungen.pdf",
    "page_number": 47,
    "raw_text": "--- Seite 47 ---\n47\nSPEKTAKULÄRE KRETE, WUNDERBARE BELOHNUNG\nBrülisau – Rossweid –\nChehr – Bärstein –\nZahme Gocht – Alp Sigel –\nPlattenbödeli – Brülisau\n3 Stunden 45 Minuten\nGasthaus Rössli,\nBerggasthaus Plattenbödeli\n8.32 km 763 m 763 m\nSAC-Wanderskala\nT 3\nBerggasthaus Plattenbödeli\nAnfangs gemächlich, später ziemlich steil verläuft der Anstieg von Brülisau über die farbigen Magerwiesen der\nRossweid zum Chehr, zur Alp Bärstein und schliesslich an den Wandfuss der Sigelwand. Hinauf geht es fast\nsenkrecht durch die spektakuläre, mit Drahtseilen versicherte Zahme Gocht. Von unten wirkt sie unbezwingbar,\ndafür ist es oben umso schöner! Ist die Felskante der Alp Sigel erklommen, eröffnet sich eine einmalige Aussicht\nauf die umliegende Bergwelt. Von der Krete geniesst man zudem gewaltige Tiefblicke nach Brülisau, Schwende\nund Weissbad. Im Anschluss folgt ein sanfter Abstieg, vorbei an neugierigen Kühen, zu den Alpgebäuden der\nAlp Sigel. Auf dem Alpweg geht es im Zickzack hinunter zum einladenden Plattenbödeli. Legen Sie hier eine Ein-\nkehrpause ein, denn der steile Schlussabstieg durch das Brüeltobel hat es in sich. Vorbei am sagenumwobenen\nHexenwäldli mit den kleinwüchsigen Tännchen, das während Jahrhunderten die Fantasie von Einheimischen\nund Gästen beflügelte, gelangen Sie zum Pfannenstiel und flach zurück nach Brülisau.\nHinweis: Der Aufstieg kann auch mit der Seilbahn Alp Sigel bewältigt werden.\nFamilie Inauen\n9058 Brülisau\nTel. +41 71 799 11 52\ninfo@plattenboedeli.ch\nwww.plattenboedeli.ch\nMai bis Anfang November,\nim Winter siehe Webseite\n50 Matratzenlager / 33 Betten\n1284 m ü. M."
  },
  {
    "id": "add1869d",
    "title": "GROSSE ALPSTEINRUNDE IN ZWEI TAGEN",
    "description": "Ebenalp (Seilbahn) – Wasserauen Rössli, Plattenbödeli, Bollenwees, Rotsteinpass, Säntis, Alter Säntis, Der Start der Tour bis zum Plattenbödeli ist steil und schweisstreibend. Da lohnt sich eine erste Verschnauf- pause beim Sämtisersee. Weiter geht es via Furgglenalp zum Berggasthaus Bollenwees am Fählensee, der",
    "region": "Appenzell",
    "duration": "11 Stunden",
    "distance": "25.27 km",
    "elevation_gain": "2366m",
    "elevation_loss": "1699m",
    "restaurants": [
      "Gasthaus Rotsteinpass",
      "Gasthaus Bollenwees am Fählensee",
      "Gasthaus lockt mit Erfrischung und Er-"
    ],
    "sac_scale": "T3",
    "highlights": [
      "Aussicht",
      "See",
      "Alpstein",
      "Säntis"
    ],
    "source_pdf": "Appenzell_Wanderungen.pdf",
    "page_number": 53,
    "raw_text": "--- Seite 53 ---\n53\nGROSSE ALPSTEINRUNDE IN ZWEI TAGEN\nBrülisau – Sämtisersee –\nBollenwees – Altmannsattel –\nRotsteinpass (Übernachtung) –\nSäntis – Schäfler –\nEbenalp (Seilbahn) – Wasserauen\n11 Stunden (1. Tag: 6 Stunden,\n2. Tag: 5 Stunden)\nRössli, Plattenbödeli, Bollenwees,\nRotsteinpass, Säntis, Alter Säntis,\nSchäfler, Ebenalp, Alpenrose\n25.27 km 2366 m 1699 m\nSAC-Wanderskala\nT 3\nBerggasthaus Rotsteinpass\nDer Start der Tour bis zum Plattenbödeli ist steil und schweisstreibend. Da lohnt sich eine erste Verschnauf-\npause beim Sämtisersee. Weiter geht es via Furgglenalp zum Berggasthaus Bollenwees am Fählensee, der\nbeidseitig von steilen Felswänden eingerahmt wird. Zuerst dem See entlang zur idyllischen Fählenalp und\ndann steiler ansteigend, führt der Weg über Häderen an den Fählentürmen vorbei mit einem steilen\nSchlussaufstieg hinauf zum Altmannsattel. Dort geht es, mit ausgesetzten Stellen, die berüchtigte und gut ge-\nsicherte Fliswand hinunter zum Berggasthaus Rotsteinpass. Das Berggasthaus lockt mit Erfrischung und Er-\nholung. Mit etwas Glück entdecken Sie am Abend einige Steinböcke oder auch ein Rudel Gämsen. Auf dem im-\nposanten Felsengratweg geht es am nächsten Tag über den Lisengrat auf den Säntis. Wie die Fliswand, ist\ndieser Abschnitt nur schwindelfreien, trittsicheren Bergwanderern zu empfehlen. Der Abstieg führt über die\nÖhrligrueb zum aussichtsreichen Berggasthaus Schäfler. Gemütlich wandern Sie abwärts zur Alp Chlus, zur\nEbenalp und mit der Luftseilbahn schweben Sie hinunter nach Wasserauen.\nFamilie Wyss\n9057 Weissbad\nTel. Sommer +41 71 799 11 41\nTel. Winter +41 71 797 00 44\ninfo@rotsteinpass.ch\nwww.rotsteinpass.ch\nJuni bis Oktober\n80 Matratzenlager / 8 Betten\n2120 m ü. M."
  },
  {
    "id": "37c94b78",
    "title": "DURCH KÜHLE WÄLDER AUF DIE EBENALP",
    "description": "Ebenalp – Wasserauen (Seilbahn) Luftseilbahn Wasserauen-Ebenalp Von Wasserauen wandern Sie dem Schwendebach entlang talauswärts und biegen beim Kletterern beliebten For- scherstein links ab. Der wunderbar angelegte Weg führt durch den kühlenden Buchenwald hoch zur Waldlichtung Blättli. Anschliessend wird der Untergrund etwas steiniger und Sie erreichen wenig später die Alp Bommen mit ih-",
    "region": "Appenzell",
    "duration": "2 Stunden 15 Minuten",
    "distance": "3.99 km",
    "elevation_gain": "734m",
    "elevation_loss": "13m",
    "restaurants": [
      "Gasthaus Alpenrose",
      "Gasthaus Ebenalp",
      "Gasthaus Ebenalp lädt ein zu Einkehr und Genuss"
    ],
    "sac_scale": "T2",
    "highlights": [
      "Gipfel",
      "See",
      "Alpstein",
      "Ebenalp"
    ],
    "source_pdf": "Appenzell_Wanderungen.pdf",
    "page_number": 55,
    "raw_text": "--- Seite 55 ---\n55\nDURCH KÜHLE WÄLDER AUF DIE EBENALP\nWasserauen –\nForscherstein – Blättliweg –\nAlp Bommen – Gartenwald –\nEbenalp – Wasserauen (Seilbahn)\n2 Stunden 15 Minuten\nGasthaus Alpenrose,\nBerggasthaus Ebenalp\n3.99 km 734 m 13 m\nSAC-Wanderskala\nT 2\nLuftseilbahn Wasserauen-Ebenalp\nVon Wasserauen wandern Sie dem Schwendebach entlang talauswärts und biegen beim Kletterern beliebten For-\nscherstein links ab. Der wunderbar angelegte Weg führt durch den kühlenden Buchenwald hoch zur Waldlichtung\nBlättli. Anschliessend wird der Untergrund etwas steiniger und Sie erreichen wenig später die Alp Bommen mit ih-\nren feinen Alpprodukten. Die Ebenalp stets im Blick, steigen Sie auf einem Kiesweg weiter auf. Sobald der Garten-\nwald-Skilift erreicht ist, folgt der sehr schöne Schlussaufstieg bis über die Waldgrenze hoch auf das Gipfel-Plateau.\nEs folgt ein optischer Genuss: Der Alpstein mit seinen Bergspitzen und die atemberaubende Fernsicht über das\nAppenzellerland mit der typischen Streusiedlung bis hin zum Bodensee lassen bestimmt auch Ihr Herz höher-\nschlagen. Die Sonnenterrasse beim Berggasthaus Ebenalp lädt ein zu Einkehr und Genuss. Zurück nach Wasser-\nauen gelangen Sie bequem mit der Luftseilbahn.\nTipp: Planen Sie die Tour im Herbst. Der farbig leuchtende Blättliwald und oftmals auch das Nebelmeer werden Sie\nbegeistern.\nLuftseilbahn\nWasserauen-Ebenalp AG\n9057 Wasserauen\nTel. +41 71 799 12 12\ninfo@ebenalp.ch\nwww.ebenalp.ch\nMai bis Oktober / Dez. bis März\n1590 m ü. M."
  },
  {
    "id": "775eb641",
    "title": "RUNDTOUR HOCH ÜBER DEM SEEALPSEE",
    "description": "Los geht die Tour bei der Bergstation der Luftseilbahn Wasserauen-Ebenalp. Ein paar Meter hinter dem Berg- gasthaus Ebenalp, das zur ersten Einkehr lockt, biegen Sie links über die Kante der Wand ab und gelangen nach ein paar Kurven auf dem schmalen Füessler-Weg an den Wandfuss. Weiter geht es auf einem gut ausgebauten Höhenweg mit prächtigem Blick hinunter auf den blau-grünen Seealpsee in angenehmem Auf und Ab bis zur Altenalp.",
    "region": "Appenzell",
    "duration": "2 Stunden 45 Minuten",
    "distance": "6.20 km",
    "elevation_gain": "543m",
    "elevation_loss": "543m",
    "restaurants": [
      "Gasthaus Ebenalp",
      "Gasthaus Schäfler",
      "Berggasthaus Ebenalp"
    ],
    "sac_scale": "T3",
    "highlights": [
      "Aussicht",
      "Panorama",
      "Gipfel",
      "See"
    ],
    "source_pdf": "Appenzell_Wanderungen.pdf",
    "page_number": 59,
    "raw_text": "--- Seite 59 ---\n59\nRUNDTOUR HOCH ÜBER DEM SEEALPSEE\nEbenalp (Seilbahn) –\nFüessler – Altenalp –\nSchäfler – Chlus – Ebenalp\n2 Stunden 45 Minuten\nBerggasthaus Ebenalp,\nBerggasthaus Schäfler\n6.20 km 543 m 543 m\nSAC-Wanderskala\nT 3\nBerggasthaus Schäfler\nLos geht die Tour bei der Bergstation der Luftseilbahn Wasserauen-Ebenalp. Ein paar Meter hinter dem Berg-\ngasthaus Ebenalp, das zur ersten Einkehr lockt, biegen Sie links über die Kante der Wand ab und gelangen nach\nein paar Kurven auf dem schmalen Füessler-Weg an den Wandfuss. Weiter geht es auf einem gut ausgebauten\nHöhenweg mit prächtigem Blick hinunter auf den blau-grünen Seealpsee in angenehmem Auf und Ab bis zur\nAltenalp. Hier werden feinste Alpprodukte hergestellt und eine Stärkung kommt gerade richtig, denn der Weg\nauf den Schäfler steigt nun steil an und erfordert Trittsicherheit. Einige Stellen sind sehr ausgesetzt, jedoch mit\nDrahtseilen gut gesichert. Oben angekommen, werden Sie für Ihre Anstrengungen mehr als belohnt. Der Schäf-\nler, ein Aussichtsgipfel der Extraklasse samt einladendem Berggasthaus, gewährt fantastische Ausblicke in alle\nHimmelsrichtungen und auch in Sachen Kulinarik dürfen Sie sich freuen. Der Abstieg führt auf dem gut ausge-\nbauten Weg und sehr aussichtsreich via Alp Chlus zurück zur Ebenalp, wo sich vor der Fahrt ins Tal ein Rund-\ngang auf dem Panoramaweg durch den blühenden Alpengarten anbietet.\nDaniel Dobler\n9057 Weissbad\nTel. +41 71 799 11 44\nwww.schaefler.ch\nJuni bis Oktober\n70 Matratzenlager / 15 Betten\n1923 m ü. M."
  },
  {
    "id": "71d2aa09",
    "title": "AUF ZUM SEEALPSEE",
    "description": "Ausgehend vom Bahnhof führt der Bergweg links ab vom Parkplatz über die Weide und einer Rinne entlang aufwärts zum Waldrand. Nun fordert Sie der Aufstieg durch das lauschige Hüttentobel: Im grünen Buchenwald begleitet Sie das Rauschen des Bergbaches, während Sie rasch an Höhe gewinnen. Ein Gatter markiert den Be- ginn des Alpgeländes der Alp Klein Hütten.",
    "region": "Appenzell",
    "duration": "2 Stunden 30 Minuten",
    "distance": "7.34 km",
    "elevation_gain": "377m",
    "elevation_loss": "377m",
    "restaurants": [
      "Gasthaus Alpenrose",
      "Gasthaus Seealpsee",
      "Gasthaus Forelle"
    ],
    "sac_scale": "T2",
    "highlights": [
      "Gipfel",
      "See",
      "Seealpsee",
      "Alpstein"
    ],
    "source_pdf": "Appenzell_Wanderungen.pdf",
    "page_number": 61,
    "raw_text": "--- Seite 61 ---\n61\nAUF ZUM SEEALPSEE\nWasserauen –\nHüttentobel – Klein und Gross\nHütten – Seealpsee – Seealp –\nChobel – Wasserauen\n2 Stunden 30 Minuten\nGasthaus Alpenrose,\nBerggasthaus Seealpsee,\nBerggasthaus Forelle\n7.34 km 377 m 377 m\nSAC-Wanderskala\nT 2\nBerggasthaus Seealpsee\nAusgehend vom Bahnhof führt der Bergweg links ab vom Parkplatz über die Weide und einer Rinne entlang\naufwärts zum Waldrand. Nun fordert Sie der Aufstieg durch das lauschige Hüttentobel: Im grünen Buchenwald\nbegleitet Sie das Rauschen des Bergbaches, während Sie rasch an Höhe gewinnen. Ein Gatter markiert den Be-\nginn des Alpgeländes der Alp Klein Hütten. Der strengste Teil ist nun geschafft und über Alpweiden verliert der\nWeg an Steigung und Sie blicken in eine prächtige Bergwelt und sichten schon bald den Säntis, den höchsten\nGipfel im Alpstein. Auf der Höhe der Alp Gross Hütten mit ihren Alpkäse-Spezialitäten öffnet sich der Blick zum\nSeealpsee, der verträumt glitzert oder spiegelglatt daliegt. Dem linken Seeufer folgend, folgt die erholsame\nSeerundwanderung. Am hinteren Seeende finden sich die verstreuten Alprechte der Seealp und auch hier wird\ngekäst. Fast am Ende der Rundtour lädt das heimelige Berggasthaus Seealpsee mit seiner grossen Terrasse di-\nrekt am See zum Verweilen ein. Romantiker geniessen zudem eine gemütliche Ruderbootfahrt. Im lichten\nWald am See steht die beliebte Bruder Klaus-Bergkapelle. Über ein steiles Gütersträsschen gelangen Sie zurück\nins Tal nach Wasserauen.\nFamilie Parpan-Dörig\n9057 Wasserauen\nTel. +41 71 799 11 40\ninfo@seealpsee.ch\nwww.seealpsee.ch\nApril bis Oktober\n40 Betten\n1141 m ü. M."
  },
  {
    "id": "47723343",
    "title": "ZWEITÄGIGE GIPFELTOUR AUF DEN SÄNTIS",
    "description": "Rotsteinpass – Lisengrat – Säntis – Höchnideri – Öhrligrueb – Schäfler – Chlus – Ebenalp – Wildkirchli – Äscher – Alp Bommen – Wasserauen Alpenrose, Meglisalp, Rotsteinpass,",
    "region": "Appenzell",
    "duration": "6 Stunden\n30 Minuten",
    "distance": "24.23 km",
    "elevation_gain": "2225m",
    "elevation_loss": "2227m",
    "restaurants": [
      "Gasthaus Alter Säntis",
      "Hütte n und Schrennen auf die Meglisalp",
      "Berggasthaus Alter Säntis"
    ],
    "sac_scale": "T3",
    "highlights": [
      "Gipfel",
      "See",
      "Alpstein",
      "Säntis"
    ],
    "source_pdf": "Appenzell_Wanderungen.pdf",
    "page_number": 63,
    "raw_text": "--- Seite 63 ---\n63\nZWEITÄGIGE GIPFELTOUR AUF DEN SÄNTIS\nWasserauen – Hütten –\nSchrennenweg – Meglisalp –\nRotsteinpass – Lisengrat – Säntis –\nHöchnideri – Öhrligrueb – Schäfler –\nChlus – Ebenalp – Wildkirchli –\nÄscher – Alp Bommen – Wasserauen\n11 Stunden (1. Tag: 6 Stunden\n30 Minuten, 2. Tag: 5 Stunden)\nAlpenrose, Meglisalp, Rotsteinpass,\nAlter Säntis, Schäfler, Ebenalp, Aescher\n24.23 km 2225 m 2227 m\nSAC-Wanderskala\nT 3\nBerggasthaus Alter Säntis\nVon Wasserauen wandern Sie via Hütten und Schrennen auf die Meglisalp, ein speziell schöner Ort mitten im\nAlpstein. Weiter geht es bergauf vorbei am idyllischen Oberchellen-Seeli zum Rotsteinpass. Eine reizvolle,\nausgesetzte und nicht zu unterschätzende Gratwanderung führt über den berühmten Lisengrat auf den Sän-\ntis. Lassen Sie sich im Berggasthaus Alter Säntis verwöhnen und geniessen Sie dabei bei guter Fernsicht einen\ntraumhaften 6-Länder-Blick. Die heimeligen Zimmer lassen Sie zufrieden einschlafen.\nAm nächsten Tag geht es die luftige, gut gesicherte Felsenpassage «Himmelsleiter» hinab und weiter über Kar-\nrenfelder zum Höchnideri-Sattel. Links grüsst das markante Öhrli und es folgt die karg-schöne Öhrligrueb bis\nSie die Felswände der Altenalptürme unterqueren und nach kurzer Gegensteigung auf dem Schäfler stehen.\nVia Alp Chlus und Ebenalp gelangen Sie durch die Wildkirchli-Höhlen zum Äscher und der Abstieg zur Bom-\nmenalp und durch den lauschigen Blättliwald führt Sie zurück nach Wasserauen.\nFamilie Manser-Abderhalden\n9107 Urnäsch\nTel. +41 71 799 11 60\ninfo@altersaentis.ch\nwww.altersaentis.ch\nMitte Mai bis Oktober\n70 Matratzenlager / 24 Betten\n2502 m ü. M."
  },
  {
    "id": "0db38679",
    "title": "VON SAFTIGEN WIESEN ZUM KARGEN KARST",
    "description": "Diese Tour startet auf der Schwägalp und verläuft zu Beginn auf dem Themenweg des NaturErlebnisparks Schwägalp Säntis. Anfänglich wandern Sie abwärts durch Wiesen, Alpgebiet und kurze Waldabschnitte, bis die Route langsam aber stetig ansteigt und über die Waldgrenze führt. Plötzlich und überraschend befinden Sie sich inmitten der kargen alpinen Welt. Den Gamschopf und den markanten Stooss im Blick geht es nun steiler der Nordwand entlang aufwärts.",
    "region": "Appenzell",
    "duration": "6 Stunden 15 Minuten",
    "distance": "11.77 km",
    "elevation_gain": "1684m",
    "elevation_loss": "566m",
    "restaurants": [
      "Restaurant Säntis",
      "Gasthaus Tierwis",
      "Gasthaus Alter Säntis"
    ],
    "sac_scale": "T3",
    "highlights": [
      "Aussicht",
      "Gipfel",
      "Säntis",
      "Alp"
    ],
    "source_pdf": "Appenzell_Wanderungen.pdf",
    "page_number": 65,
    "raw_text": "--- Seite 65 ---\n65\nVON SAFTIGEN WIESEN ZUM KARGEN KARST\nSchwägalp – Dunkelboden –\nBumoos – Ober Hofeld –\nStosssattel – Silberplatten –\nTierwis – Säntis\n6 Stunden 15 Minuten\nSäntis – das Hotel,\nBerggasthaus Tierwis,\nTerrassen-Restaurant Säntis,\nBerggasthaus Alter Säntis\n11.77 km 1684 m 566 m\nSAC-Wanderskala\nT 3\nBerggasthaus Tierwis\nDiese Tour startet auf der Schwägalp und verläuft zu Beginn auf dem Themenweg des NaturErlebnisparks Schwägalp\nSäntis. Anfänglich wandern Sie abwärts durch Wiesen, Alpgebiet und kurze Waldabschnitte, bis die Route langsam\naber stetig ansteigt und über die Waldgrenze führt. Plötzlich und überraschend befinden Sie sich inmitten der kargen\nalpinen Welt. Den Gamschopf und den markanten Stooss im Blick geht es nun steiler der Nordwand entlang aufwärts.\nDer Weg über den Stoosssattel ist auch wegen der Aussicht sehr reizvoll. Verpassen Sie kurz nach dem Sattel den Ab-\nzweiger zu den Silberplatten nicht. Diesen wunderbaren und wenig begangenen Gipfel müssen Sie erklommen ha-\nben. Zurück auf dem Hauptweg wandern Sie durch faszinierendes Karstgelände zum Berggasthaus Tierwis. Kehren\nSie ein und geniessen Sie die Aussicht ins Toggenburg und ins Appenzellerland. Nun liegt die letzte Etappe vor Ih-\nnen: Vorbei an der zweiten Stütze der Säntis Schwebebahn und hindurch unter den Zugseilen der Schwebebahn geht\nes aufwärts zum Girensattel. Nach einer kurzen Traverse folgt der Schluss- und Höhepunkt, denn via «Himmelslei-\nter» gelangen Sie zum Säntisgipfel. Mit der Säntisbahn schweben Sie bequem ins Tal zurück.\nFamilie Schoop\n9107 Urnäsch\nTel. +41 71 364 12 35\ninfo@tierwis.ch\nwww.tierwis.ch\nJuli bis Mitte Oktober / ab Juni\nan schönen Wochenenden\n48 Matratzenlager / 2 Betten\n2085 m ü. M."
  },
  {
    "id": "2677792a",
    "title": "DER GEOLOGISCHE WANDERWEG",
    "description": "Der Alpstein ist auch in geologischer Hinsicht absolut spannend. Startort dieser Bergwanderung ist der Hohe Kasten mit seiner berühmten Panorama-Aussicht. Dieser erste geologische Wanderweg der Schweiz führt via Berggasthaus Staubern zur Saxerlücke entlang der südlichen Kette des Alpsteins und eröffnet sowohl dem Laien wie auch dem Kundigen in faszinierender Vielfalt die geologischen Entwicklungen der vergangenen Jahrtausende.",
    "region": "Appenzell",
    "duration": "5 Stunden 30 Minuten",
    "distance": "16.21 km",
    "elevation_gain": "652m",
    "elevation_loss": "1521m",
    "restaurants": [
      "Restaurant Hoher Kasten",
      "Gasthaus Staubern",
      "Gasthaus Bollenwees"
    ],
    "sac_scale": "T2",
    "highlights": [
      "Aussicht",
      "Panorama",
      "See",
      "Alpstein"
    ],
    "source_pdf": "Appenzell_Wanderungen.pdf",
    "page_number": 71,
    "raw_text": "--- Seite 71 ---\n71\nDER GEOLOGISCHE WANDERWEG\nHoher Kasten (Seilbahn) –\nStaubern – Saxer Lücke –\nBollenwees (– Plattenbödeli /\nRuhesitz – Brülisau)\n5 Stunden 30 Minuten\nDrehrestaurant Hoher Kasten,\nBerggasthaus Staubern,\nBerggasthaus Bollenwees,\nBerggasthaus Plattenbödeli,\nGasthaus Rössli Brülisau\n16.21 km 652 m 1521 m\nSAC-Wanderskala\nT 2\nDer Alpstein ist auch in geologischer Hinsicht absolut spannend. Startort dieser Bergwanderung ist der Hohe\nKasten mit seiner berühmten Panorama-Aussicht. Dieser erste geologische Wanderweg der Schweiz führt via\nBerggasthaus Staubern zur Saxerlücke entlang der südlichen Kette des Alpsteins und eröffnet sowohl dem\nLaien wie auch dem Kundigen in faszinierender Vielfalt die geologischen Entwicklungen der vergangenen\nJahrtausende. Die Route ist mit 15 attraktiven Thementafeln ausgestattet, die dem Betrachter zahlreiche Phä-\nnomene der Geologie anschaulich erklären und Sie werden vieles davon auch gleich unterwegs in Ihrer Umge-\nbung entdecken.\nZu sehen sind Versteinerungen. Verwitterungsformen, unterirdisch entwässernde Seen, Falten und Brüche.\nBesonders beeindruckend ist der berühmte Sax-Schwende-Bruch, wo die Verschiebung des Ostmassivs um\nein paar hundert Meter deutlich zu sehen ist. Nach einem kurzen Abstieg von der Saxer Lücke erreichen Sie\ndas wunderbar am Fählensee gelegene Berggasthaus Bollenwees, wo der geologische Wanderweg endet. Der\nWeg zurück ins Tal führt entweder via Sämtisersee und Berggasthaus Plattenbödeli oder via Rainhütten und\nBerggasthaus Ruhesitz nach Brülisau."
  },
  {
    "id": "02ba0c92",
    "title": "APPENZELLER KAPELLENWEG",
    "description": "diverse Rest. im Dorf Appenzell, Von der Tourist Info Appenzell aus geht es zuerst durch die belebte Hauptgasse vorbei an der Kreuzkapelle und geradeaus zur stattlichen St. Antonius-Kapelle. Nachdem Sie ein kurzes Stück in Herkunftsrichtung zu- rückgegangen sind, führt der Weg vis-à-vis des Gymnasiums links ab via Sandgrube zur ehemaligen Münz- prägerei. Nach der Überquerung des Kaubachs passieren Sie die Dreifaltigkeits-Kapelle mit herrlicher Ruhe-",
    "region": "Appenzell",
    "duration": "4 Stunden 30 Minuten",
    "distance": "16.09 km",
    "elevation_gain": "480m",
    "elevation_loss": "480m",
    "restaurants": [
      "Restaurant Bäckerei Schäfli"
    ],
    "sac_scale": "T1",
    "highlights": [
      "Aussicht",
      "Alpstein",
      "Alp"
    ],
    "source_pdf": "Appenzell_Wanderungen.pdf",
    "page_number": 78,
    "raw_text": "--- Seite 78 ---\n7788\nAPPENZELLER KAPELLENWEG\nAppenzell – Münz – Lank –\nSteig – Burg Clanx – Lehn –\nStuden – Sammelplatz –\nGuggerloch – Steinegg –\nAppenzell\n4 Stunden 30 Minuten\ndiverse Rest. im Dorf Appenzell,\nRestaurant Bäckerei Schäfli\nSteinegg\n16.09 km 480 m 480 m\nAppenzeller\nKapellenweg\nSAC-Wanderskala\nT 1\nVon der Tourist Info Appenzell aus geht es zuerst durch die belebte Hauptgasse vorbei an der Kreuzkapelle\nund geradeaus zur stattlichen St. Antonius-Kapelle. Nachdem Sie ein kurzes Stück in Herkunftsrichtung zu-\nrückgegangen sind, führt der Weg vis-à-vis des Gymnasiums links ab via Sandgrube zur ehemaligen Münz-\nprägerei. Nach der Überquerung des Kaubachs passieren Sie die Dreifaltigkeits-Kapelle mit herrlicher Ruhe-\nbank und in einem weiten Bogen führt der Weg nun zur Sitter. Über die wunderschöne, gedeckte Holzbrücke\ngelangen Sie via Lank zur kleinen Kapelle St. Verena. Nach einem steilen aber kurzen Aufstieg erreichen Sie\ndie St. Karl Borromäus Kapelle auf der Steig, eine der historisch bedeutendsten Kapellen der Pfarrei Appen-\nzell in einmaliger Lage.\nDer Kapellenweg führt nun stetig ansteigend und durch ein kurzes Waldstück um den Burghügel herum,\nhinauf zur Burgruine Clanx, dem wohl schönsten Aussichtspunkt des gesamten Rundweges. Das nächste Ziel\nist die herrlich sonnig gelegene Lehnkapelle. Zum Dorf Sammelplatz ist es nun nicht mehr weit, wo Sie die\nziewhcS dnalrednaW\nTHEMENWEGE\n990\n--- Seite 79 ---\n79\nBahngeleise überqueren und schon bald zur romantischen Waldkapelle St. Ottilia im Guggerloch gelangen.\nIm festen Glauben an die Kraft des Wassers zur Heilung von Augenleiden, besuchen noch heute viele Gläubige\ndie besondere Kapelle, die der Schutzpatronin des Augenlichts geweiht ist. Oberhalb dieser Kapelle sehen Sie\nden Alpstein in seiner ganzen Pracht vor sich und mit diesem Ausblick geht es nun über Wiesenwege hinunter\nnach Steinegg. Bei der ersten Liegenschaft findet sich übrigens die winzige, geschlossene Kapelle St. Barbara\nam Schönenbühl. In Steinegg finden Sie die Chäsmoos-Kapelle und bevor es der Sitter entlang zurück nach\nAppenzell geht, dürfen Sie die farbenfrohe Kapelle St. Magdalena in Steinegg nicht verpassen.\nBald ist die St. Anna-Kapelle zu sehen, welche als schönste Rokoko-Kapelle Innerrhodens gilt. Weiter folgen\nSie der Sitter bis rechts auf einer kleinen Anhöhe beim Hallenbad die Lourdes-Kapelle grüsst. Beliebt für\nMaiandachten, liegt diese letzte Kapelle besonders schön. Ein letztes Mal wird die Sitter auf einem Fussgän-\ngersteg überquert und Sie sind zurück im Dorfkern von Appenzell.\nTipp: Ungefähr die Hälfte der Kapellen am Weg ist täglich geöffnet und begehbar. Die anderen sind entweder\nstets geschlossen oder an spezifischen hohen Sonntagen geöffnet. Bringen Sie am besten eine Taschenlampe\noder Ihr Handy mit, um damit das schummrige Innere der Kapellen sichtbar zu machen.\nMehr zur\nKa\nn i\nf p\nn e\na e\nll t\ne I\ne a\nn i\nn s\nt l\na i\nd h\ns e\ne c\nl r\ne e r\nBroschüre!"
  }
]